{
  "schema_version": "wake.environment_timeline.v1",
  "timeline_id": "environment-case-004-steady-headwind-compliant",
  "source": {
    "kind": "SYNTHETIC",
    "source_ref": "scripts/generate_diagnostic_cases.py",
    "quality": "HIGH"
  },
  "direction_convention": "METEOROLOGICAL_FROM_DEGREES_TRUE_NORTH",
  "samples": [
    {
      "timestamp": "2026-02-03T06:00:00.000-03:00",
      "wind_speed_m_s": 4.0,
      "wind_direction_deg": 0.0,
      "gust_speed_m_s": 4.5,
      "temperature_c": 19.0
    },
    {
      "timestamp": "2026-02-03T06:00:30.000-03:00",
      "wind_speed_m_s": 4.0,
      "wind_direction_deg": 0.0,
      "gust_speed_m_s": 4.5,
      "temperature_c": 19.0
    },
    {
      "timestamp": "2026-02-03T06:01:00.000-03:00",
      "wind_speed_m_s": 4.0,
      "wind_direction_deg": 0.0,
      "gust_speed_m_s": 4.5,
      "temperature_c": 19.0
    },
    {
      "timestamp": "2026-02-03T06:01:30.000-03:00",
      "wind_speed_m_s": 4.0,
      "wind_direction_deg": 0.0,
      "gust_speed_m_s": 4.5,
      "temperature_c": 19.0
    },
    {
      "timestamp": "2026-02-03T06:02:00.000-03:00",
      "wind_speed_m_s": 4.0,
      "wind_direction_deg": 0.0,
      "gust_speed_m_s": 4.5,
      "temperature_c": 19.0
    },
    {
      "timestamp": "2026-02-03T06:02:30.000-03:00",
      "wind_speed_m_s": 4.0,
      "wind_direction_deg": 0.0,
      "gust_speed_m_s": 4.5,
      "temperature_c": 19.0
    },
    {
      "timestamp": "2026-02-03T06:03:00.000-03:00",
      "wind_speed_m_s": 4.0,
      "wind_direction_deg": 0.0,
      "gust_speed_m_s": 4.5,
      "temperature_c": 19.0
    },
    {
      "timestamp": "2026-02-03T06:03:30.000-03:00",
      "wind_speed_m_s": 4.0,
      "wind_direction_deg": 0.0,
      "gust_speed_m_s": 4.5,
      "temperature_c": 19.0
    },
    {
      "timestamp": "2026-02-03T06:04:00.000-03:00",
      "wind_speed_m_s": 4.0,
      "wind_direction_deg": 0.0,
      "gust_speed_m_s": 4.5,
      "temperature_c": 19.0
    },
    {
      "timestamp": "2026-02-03T06:04:30.000-03:00",
      "wind_speed_m_s": 4.0,
      "wind_direction_deg": 0.0,
      "gust_speed_m_s": 4.5,
      "temperature_c": 19.0
    },
    {
      "timestamp": "2026-02-03T06:05:00.000-03:00",
      "wind_speed_m_s": 4.0,
      "wind_direction_deg": 0.0,
      "gust_speed_m_s": 4.5,
      "temperature_c": 19.0
    },
    {
      "timestamp": "2026-02-03T06:05:30.000-03:00",
      "wind_speed_m_s": 4.0,
      "wind_direction_deg": 0.0,
      "gust_speed_m_s": 4.5,
      "temperature_c": 19.0
    },
    {
      "timestamp": "2026-02-03T06:06:00.000-03:00",
      "wind_speed_m_s": 4.0,
      "wind_direction_deg": 0.0,
      "gust_speed_m_s": 4.5,
      "temperature_c": 19.0
    },
    {
      "timestamp": "2026-02-03T06:06:30.000-03:00",
      "wind_speed_m_s": 4.0,
      "wind_direction_deg": 0.0,
      "gust_speed_m_s": 4.5,
      "temperature_c": 19.0
    },
    {
      "timestamp": "2026-02-03T06:07:00.000-03:00",
      "wind_speed_m_s": 4.0,
      "wind_direction_deg": 0.0,
      "gust_speed_m_s": 4.5,
      "temperature_c": 19.0
    },
    {
      "timestamp": "2026-02-03T06:07:30.000-03:00",
      "wind_speed_m_s": 4.0,
      "wind_direction_deg": 0.0,
      "gust_speed_m_s": 4.5,
      "temperature_c": 19.0
    },
    {
      "timestamp": "2026-02-03T06:08:00.000-03:00",
      "wind_speed_m_s": 4.0,
      "wind_direction_deg": 0.0,
      "gust_speed_m_s": 4.5,
      "temperature_c": 19.0
    },
    {
      "timestamp": "2026-02-03T06:08:30.000-03:00",
      "wind_speed_m_s": 4.0,
      "wind_direction_deg": 0.0,
      "gust_speed_m_s": 4.5,
      "temperature_c": 19.0
    },
    {
      "timestamp": "2026-02-03T06:09:00.000-03:00",
      "wind_speed_m_s": 4.0,
      "wind_direction_deg": 0.0,
      "gust_speed_m_s": 4.5,
      "temperature_c": 19.0
    },
    {
      "timestamp": "2026-02-03T06:09:30.000-03:00",
      "wind_speed_m_s": 4.0,
      "wind_direction_deg": 0.0,
      "gust_speed_m_s": 4.5,
      "temperature_c": 19.0
    },
    {
      "timestamp": "2026-02-03T06:10:00.000-03:00",
      "wind_speed_m_s": 4.0,
      "wind_direction_deg": 0.0,
      "gust_speed_m_s": 4.5,
      "temperature_c": 19.0
    },
    {
      "timestamp": "2026-02-03T06:10:30.000-03:00",
      "wind_speed_m_s": 4.0,
      "wind_direction_deg": 0.0,
      "gust_speed_m_s": 4.5,
      "temperature_c": 19.0
    },
    {
      "timestamp": "2026-02-03T06:11:00.000-03:00",
      "wind_speed_m_s": 4.0,
      "wind_direction_deg": 0.0,
      "gust_speed_m_s": 4.5,
      "temperature_c": 19.0
    },
    {
      "timestamp": "2026-02-03T06:11:30.000-03:00",
      "wind_speed_m_s": 4.0,
      "wind_direction_deg": 0.0,
      "gust_speed_m_s": 4.5,
      "temperature_c": 19.0
    },
    {
      "timestamp": "2026-02-03T06:12:00.000-03:00",
      "wind_speed_m_s": 4.0,
      "wind_direction_deg": 0.0,
      "gust_speed_m_s": 4.5,
      "temperature_c": 19.0
    },
    {
      "timestamp": "2026-02-03T06:12:30.000-03:00",
      "wind_speed_m_s": 4.0,
      "wind_direction_deg": 0.0,
      "gust_speed_m_s": 4.5,
      "temperature_c": 19.0
    },
    {
      "timestamp": "2026-02-03T06:13:00.000-03:00",
      "wind_speed_m_s": 4.0,
      "wind_direction_deg": 0.0,
      "gust_speed_m_s": 4.5,
      "temperature_c": 19.0
    },
    {
      "timestamp": "2026-02-03T06:13:30.000-03:00",
      "wind_speed_m_s": 4.0,
      "wind_direction_deg": 0.0,
      "gust_speed_m_s": 4.5,
      "temperature_c": 19.0
    },
    {
      "timestamp": "2026-02-03T06:14:00.000-03:00",
      "wind_speed_m_s": 4.0,
      "wind_direction_deg": 0.0,
      "gust_speed_m_s": 4.5,
      "temperature_c": 19.0
    },
    {
      "timestamp": "2026-02-03T06:14:30.000-03:00",
      "wind_speed_m_s": 4.0,
      "wind_direction_deg": 0.0,
      "gust_speed_m_s": 4.5,
      "temperature_c": 19.0
    },
    {
      "timestamp": "2026-02-03T06:15:00.000-03:00",
      "wind_speed_m_s": 4.0,
      "wind_direction_deg": 0.0,
      "gust_speed_m_s": 4.5,
      "temperature_c": 19.0
    },
    {
      "timestamp": "2026-02-03T06:15:30.000-03:00",
      "wind_speed_m_s": 4.0,
      "wind_direction_deg": 0.0,
      "gust_speed_m_s": 4.5,
      "temperature_c": 19.0
    },
    {
      "timestamp": "2026-02-03T06:16:00.000-03:00",
      "wind_speed_m_s": 4.0,
      "wind_direction_deg": 0.0,
      "gust_speed_m_s": 4.5,
      "temperature_c": 19.0
    },
    {
      "timestamp": "2026-02-03T06:16:30.000-03:00",
      "wind_speed_m_s": 4.0,
      "wind_direction_deg": 0.0,
      "gust_speed_m_s": 4.5,
      "temperature_c": 19.0
    },
    {
      "timestamp": "2026-02-03T06:17:00.000-03:00",
      "wind_speed_m_s": 4.0,
      "wind_direction_deg": 0.0,
      "gust_speed_m_s": 4.5,
      "temperature_c": 19.0
    },
    {
      "timestamp": "2026-02-03T06:17:30.000-03:00",
      "wind_speed_m_s": 4.0,
      "wind_direction_deg": 0.0,
      "gust_speed_m_s": 4.5,
      "temperature_c": 19.0
    },
    {
      "timestamp": "2026-02-03T06:18:00.000-03:00",
      "wind_speed_m_s": 4.0,
      "wind_direction_deg": 0.0,
      "gust_speed_m_s": 4.5,
      "temperature_c": 19.0
    },
    {
      "timestamp": "2026-02-03T06:18:30.000-03:00",
      "wind_speed_m_s": 4.0,
      "wind_direction_deg": 0.0,
      "gust_speed_m_s": 4.5,
      "temperature_c": 19.0
    },
    {
      "timestamp": "2026-02-03T06:19:00.000-03:00",
      "wind_speed_m_s": 4.0,
      "wind_direction_deg": 0.0,
      "gust_speed_m_s": 4.5,
      "temperature_c": 19.0
    },
    {
      "timestamp": "2026-02-03T06:19:30.000-03:00",
      "wind_speed_m_s": 4.0,
      "wind_direction_deg": 0.0,
      "gust_speed_m_s": 4.5,
      "temperature_c": 19.0
    }
  ]
}
